### ISSUE TITLE
EventListeners stops receiving events randomly

### ISSUE THREAD

**Issue by ekarlso** [tektoncd/triggers#824]
# Expected Behavior
EL's should be receiving events especially when near no load.

# Actual Behavior
EL's are hanging totally randomly when running inside Istio ServiceMesh. 

I have tested rebuilding the Tekton triggers 

ss -s - in the EL's container

```
Transport Total     IP        IPv6
RAW	  0         0         0        
UDP	  0         0         0        
TCP	  20        14        6        
INET	  20        14        6        
FRAG	  0         0         0        
```

Also it doesnt seem to be Istio related sicne when I'm shelled into the container I can't reach the EL on localhost:8080 either as it just hangs.

If I go into  container I built  with exec also 
# Steps to Reproduce the Problem

# Additional Info

- Kubernetes version:

  ```
Client Version: version.Info{Major:"1", Minor:"19", GitVersion:"v1.19.3", GitCommit:"1e11e4a2108024935ecfcb2912226cedeafd99df", GitTreeState:"clean", BuildDate:"2020-10-15T11:35:50Z", GoVersion:"go1.15.2", Compiler:"gc", Platform:"linux/amd64"}
Server Version: version.Info{Major:"1", Minor:"17", GitVersion:"v1.17.11", GitCommit:"3a3612132641768edd7f7e73d07772225817f630", GitTreeState:"clean", BuildDate:"2020-09-02T06:46:33Z", GoVersion:"go1.13.15", Compiler:"gc", Platform:"linux/amd64"}
 ```

- Tekton Pipeline version:

```
Client version: 0.13.1
Pipeline version: v0.17.2
Triggers version: devel
Dashboard version: v0.10.0
```

**Comment by dibyom** [comment]
From Slack thread:

1. Would be nice to get some pcap to see if there are any clues. ideally two things - packets when everything is working, and one when you make a request to the EL when its hanging. I don't have anything specific to look for but I was hoping having that info would provide some clues on what is going on. 

2. another thing to try would be to get some profiling info from the EL itself (something like https://stackoverflow.com/a/19145992)


3. also, are there any pattern on when the EL hangs? e.g. after a few hours of being created etc.?

4. and does restarting the pod help?

**Comment by ekarlso** [comment]
1. PCAP from curl localhost:8080 on the EL pod
```
21:39:58.081168 IP localhost.40126 > localhost.http-alt: Flags [S], seq 3387048474, win 65495, options [mss 65495,sackOK,TS val 695104799 ecr 0,nop,wscale 7], length 0
21:39:58.081177 IP localhost.http-alt > localhost.40126: Flags [S.], seq 4179568692, ack 3387048475, win 65483, options [mss 65495,sackOK,TS val 695104799 ecr 695104799,nop,wscale 7], length 0
21:39:58.081185 IP localhost.40126 > localhost.http-alt: Flags [.], ack 1, win 512, options [nop,nop,TS val 695104799 ecr 695104799], length 0
21:39:58.081372 IP localhost.40126 > localhost.http-alt: Flags [P.], seq 1:116, ack 1, win 512, options [nop,nop,TS val 695104800 ecr 695104799], length 115: HTTP: GET /live HTTP/1.1
21:39:58.081391 IP localhost.http-alt > localhost.40126: Flags [.], ack 116, win 511, options [nop,nop,TS val 695104800 ecr 695104800], length 0
21:39:58.081495 IP localhost.http-alt > localhost.40126: Flags [P.], seq 1:138, ack 116, win 512, options [nop,nop,TS val 695104800 ecr 695104800], length 137: HTTP: HTTP/1.1 200 OK
21:39:58.081512 IP localhost.40126 > localhost.http-alt: Flags [.], ack 138, win 511, options [nop,nop,TS val 695104800 ecr 695104800], length 0
21:39:58.081544 IP localhost.http-alt > localhost.40126: Flags [F.], seq 138, ack 116, win 512, options [nop,nop,TS val 695104800 ecr 695104800], length 0
21:39:58.081612 IP localhost.40126 > localhost.http-alt: Flags [F.], seq 116, ack 139, win 512, options [nop,nop,TS val 695104800 ecr 695104800], length 0
21:39:58.081626 IP localhost.http-alt > localhost.40126: Flags [.], ack 117, win 512, options [nop,nop,TS val 695104800 ecr 695104800], length 0
21:40:00.011767 IP localhost.56596 > localhost.15020: Flags [P.], seq 202274784:202275027, ack 3551708269, win 512, options [nop,nop,TS val 695106730 ecr 695104730], length 243
21:40:00.011943 IP localhost.15020 > localhost.56596: Flags [P.], seq 1:76, ack 243, win 3075, options [nop,nop,TS val 695106730 ecr 695106730], length 75
21:40:00.011964 IP localhost.56596 > localhost.15020: Flags [.], ack 76, win 512, options [nop,nop,TS val 695106730 ecr 695106730], length 0
21:40:00.946270 IP localhost.40176 > localhost.http-alt: Flags [S], seq 2778817181, win 65495, options [mss 65495,sackOK,TS val 695107664 ecr 0,nop,wscale 7], length 0
21:40:00.946280 IP localhost.http-alt > localhost.40176: Flags [S.], seq 3447535958, ack 2778817182, win 65483, options [mss 65495,sackOK,TS val 695107664 ecr 695107664,nop,wscale 7], length 0
21:40:00.946288 IP localhost.40176 > localhost.http-alt: Flags [.], ack 1, win 512, options [nop,nop,TS val 695107664 ecr 695107664], length 0
21:40:00.946343 IP localhost.40176 > localhost.http-alt: Flags [P.], seq 1:79, ack 1, win 512, options [nop,nop,TS val 695107665 ecr 695107664], length 78: HTTP: GET / HTTP/1.1
21:40:00.946347 IP localhost.http-alt > localhost.40176: Flags [.], ack 79, win 511, options [nop,nop,TS val 695107665 ecr 695107665], length 0
21:40:00.946702 IP el-tekton-ci-webhook-95f764695-xdcxw.56958 > localhost.15001: Flags [P.], seq 3627409023:3627409062, ack 3186940668, win 501, options [nop,nop,TS val 4249072097 ecr 2494513484], length 39
21:40:00.946718 IP kubernetes.default.svc.cluster.local.https > el-tekton-ci-webhook-95f764695-xdcxw.56958: Flags [.], ack 3627409062, win 512, options [nop,nop,TS val 2494518061 ecr 4249072097], length 0
21:40:02.012089 IP localhost.56516 > localhost.15020: Flags [P.], seq 3600963079:3600963322, ack 1722817029, win 512, options [nop,nop,TS val 695108730 ecr 695094730], length 243
21:40:02.012272 IP localhost.15020 > localhost.56516: Flags [P.], seq 1:76, ack 243, win 1224, options [nop,nop,TS val 695108730 ecr 695108730], length 75
21:40:02.012300 IP localhost.56516 > localhost.15020: Flags [.], ack 76, win 512, options [nop,nop,TS val 695108730 ecr 695108730], length 0
21:40:03.382456 IP localhost.40224 > localhost.http-alt: Flags [S], seq 987881240, win 65495, options [mss 65495,sackOK,TS val 695110101 ecr 0,nop,wscale 7], length 0
21:40:03.382472 IP localhost.http-alt > localhost.40224: Flags [S.], seq 597434454, ack 987881241, win 65483, options [mss 65495,sackOK,TS val 695110101 ecr 695110101,nop,wscale 7], length 0
21:40:03.382489 IP localhost.40224 > localhost.http-alt: Flags [.], ack 1, win 512, options [nop,nop,TS val 695110101 ecr 695110101], length 0
21:40:03.382747 IP localhost.40224 > localhost.http-alt: Flags [P.], seq 1:116, ack 1, win 512, options [nop,nop,TS val 695110101 ecr 695110101], length 115: HTTP: GET /live HTTP/1.1
21:40:03.382766 IP localhost.http-alt > localhost.40224: Flags [.], ack 116, win 511, options [nop,nop,TS val 695110101 ecr 695110101], length 0
21:40:03.382941 IP localhost.http-alt > localhost.40224: Flags [P.], seq 1:138, ack 116, win 512, options [nop,nop,TS val 695110101 ecr 695110101], length 137: HTTP: HTTP/1.1 200 OK
21:40:03.382974 IP localhost.40224 > localhost.http-alt: Flags [.], ack 138, win 511, options [nop,nop,TS val 695110101 ecr 695110101], length 0
21:40:03.383020 IP localhost.http-alt > localhost.40224: Flags [F.], seq 138, ack 116, win 512, options [nop,nop,TS val 695110101 ecr 695110101], length 0
21:40:03.383117 IP localhost.40224 > localhost.http-alt: Flags [F.], seq 116, ack 139, win 512, options [nop,nop,TS val 695110101 ecr 695110101], length 0
21:40:03.383143 IP localhost.http-alt > localhost.40224: Flags [.], ack 117, win 512, options [nop,nop,TS val 695110101 ecr 695110101], length 0
21:40:04.011832 IP localhost.56596 > localhost.15020: Flags [P.], seq 243:486, ack 76, win 512, options [nop,nop,TS val 695110730 ecr 695106730], length 243
21:40:04.011944 IP localhost.15020 > localhost.56596: Flags [P.], seq 76:151, ack 486, win 3075, options [nop,nop,TS val 695110730 ecr 695110730], length 75
21:40:04.011956 IP localhost.56596 > localhost.15020: Flags [.], ack 151, win 512, options [nop,nop,TS val 695110730 ecr 695110730], length 0
21:40:06.011607 IP localhost.56516 > localhost.15020: Flags [P.], seq 243:486, ack 76, win 512, options [nop,nop,TS val 695112730 ecr 695108730], length 243
21:40:06.011744 IP localhost.15020 > localhost.56516: Flags [P.], seq 76:151, ack 486, win 1232, options [nop,nop,TS val 695112730 ecr 695112730], length 75
21:40:06.011759 IP localhost.56516 > localhost.15020: Flags [.], ack 151, win 512, options [nop,nop,TS val 695112730 ecr 695112730], length 0
21:40:08.011578 IP localhost.56516 > localhost.15020: Flags [P.], seq 486:729, ack 151, win 512, options [nop,nop,TS val 695114730 ecr 695112730], length 243
21:40:08.011721 IP localhost.15020 > localhost.56516: Flags [P.], seq 151:226, ack 729, win 1241, options [nop,nop,TS val 695114730 ecr 695114730], length 75
21:40:08.011735 IP localhost.56516 > localhost.15020: Flags [.], ack 226, win 512, options [nop,nop,TS val 695114730 ecr 695114730], length 0
21:40:08.081439 IP localhost.40298 > localhost.http-alt: Flags [S], seq 3278414393, win 65495, options [mss 65495,sackOK,TS val 695114800 ecr 0,nop,wscale 7], length 0
21:40:08.081455 IP localhost.http-alt > localhost.40298: Flags [S.], seq 3042428450, ack 3278414394, win 65483, options [mss 65495,sackOK,TS val 695114800 ecr 695114800,nop,wscale 7], length 0
21:40:08.081467 IP localhost.40298 > localhost.http-alt: Flags [.], ack 1, win 512, options [nop,nop,TS val 695114800 ecr 695114800], length 0
21:40:08.081728 IP localhost.40298 > localhost.http-alt: Flags [P.], seq 1:116, ack 1, win 512, options [nop,nop,TS val 695114800 ecr 695114800], length 115: HTTP: GET /live HTTP/1.1
21:40:08.081741 IP localhost.http-alt > localhost.40298: Flags [.], ack 116, win 511, options [nop,nop,TS val 695114800 ecr 695114800], length 0
21:40:08.081843 IP localhost.http-alt > localhost.40298: Flags [P.], seq 1:138, ack 116, win 512, options [nop,nop,TS val 695114800 ecr 695114800], length 137: HTTP: HTTP/1.1 200 OK
21:40:08.081854 IP localhost.40298 > localhost.http-alt: Flags [.], ack 138, win 511, options [nop,nop,TS val 695114800 ecr 695114800], length 0
21:40:08.081883 IP localhost.http-alt > localhost.40298: Flags [F.], seq 138, ack 116, win 512, options [nop,nop,TS val 695114800 ecr 695114800], length 0
21:40:08.081951 IP localhost.40298 > localhost.http-alt: Flags [F.], seq 116, ack 139, win 512, options [nop,nop,TS val 695114800 ecr 695114800], length 0
21:40:08.081960 IP localhost.http-alt > localhost.40298: Flags [.], ack 117, win 512, options [nop,nop,TS val 695114800 ecr 695114800], length 0
21:40:10.012092 IP localhost.56596 > localhost.15020: Flags [P.], seq 486:729, ack 151, win 512, options [nop,nop,TS val 695116730 ecr 695110730], length 243
21:40:10.012272 IP localhost.15020 > localhost.56596: Flags [P.], seq 151:226, ack 729, win 3075, options [nop,nop,TS val 695116730 ecr 695116730], length 75
21:40:10.012298 IP localhost.56596 > localhost.15020: Flags [.], ack 226, win 512, options [nop,nop,TS val 695116730 ecr 695116730], length 0
21:40:12.011839 IP localhost.56596 > localhost.15020: Flags [P.], seq 729:972, ack 226, win 512, options [nop,nop,TS val 695118730 ecr 695116730], length 243
21:40:12.012018 IP localhost.15020 > localhost.56596: Flags [P.], seq 226:301, ack 972, win 3075, options [nop,nop,TS val 695118730 ecr 695118730], length 75
21:40:12.012040 IP localhost.56596 > localhost.15020: Flags [.], ack 301, win 512, options [nop,nop,TS val 695118730 ecr 695118730], length 0
21:40:13.382336 IP localhost.40400 > localhost.http-alt: Flags [S], seq 3623231722, win 65495, options [mss 65495,sackOK,TS val 695120101 ecr 0,nop,wscale 7], length 0
21:40:13.382346 IP localhost.http-alt > localhost.40400: Flags [S.], seq 107715969, ack 3623231723, win 65483, options [mss 65495,sackOK,TS val 695120101 ecr 695120101,nop,wscale 7], length 0
21:40:13.382356 IP localhost.40400 > localhost.http-alt: Flags [.], ack 1, win 512, options [nop,nop,TS val 695120101 ecr 695120101], length 0
21:40:13.382531 IP localhost.40400 > localhost.http-alt: Flags [P.], seq 1:116, ack 1, win 512, options [nop,nop,TS val 695120101 ecr 695120101], length 115: HTTP: GET /live HTTP/1.1
21:40:13.382540 IP localhost.http-alt > localhost.40400: Flags [.], ack 116, win 511, options [nop,nop,TS val 695120101 ecr 695120101], length 0
21:40:13.382664 IP localhost.http-alt > localhost.40400: Flags [P.], seq 1:138, ack 116, win 512, options [nop,nop,TS val 695120101 ecr 695120101], length 137: HTTP: HTTP/1.1 200 OK
21:40:13.382677 IP localhost.40400 > localhost.http-alt: Flags [.], ack 138, win 511, options [nop,nop,TS val 695120101 ecr 695120101], length 0
21:40:13.382710 IP localhost.http-alt > localhost.40400: Flags [F.], seq 138, ack 116, win 512, options [nop,nop,TS val 695120101 ecr 695120101], length 0
21:40:13.382789 IP localhost.40400 > localhost.http-alt: Flags [F.], seq 116, ack 139, win 512, options [nop,nop,TS val 695120101 ecr 695120101], length 0
21:40:13.382802 IP localhost.http-alt > localhost.40400: Flags [.], ack 117, win 512, options [nop,nop,TS val 695120101 ecr 695120101], length 0
21:40:14.011485 IP localhost.56596 > localhost.15020: Flags [P.], seq 972:1215, ack 301, win 512, options [nop,nop,TS val 695120730 ecr 695118730], length 243
21:40:14.011607 IP localhost.15020 > localhost.56596: Flags [P.], seq 301:376, ack 1215, win 3075, options [nop,nop,TS val 695120730 ecr 695120730], length 75
21:40:14.011624 IP localhost.56596 > localhost.15020: Flags [.], ack 376, win 512, options [nop,nop,TS val 695120730 ecr 695120730], length 0
21:40:16.011821 IP localhost.56596 > localhost.15020: Flags [P.], seq 1215:1458, ack 376, win 512, options [nop,nop,TS val 695122730 ecr 695120730], length 243
21:40:16.012022 IP localhost.15020 > localhost.56596: Flags [P.], seq 376:451, ack 1458, win 3075, options [nop,nop,TS val 695122730 ecr 695122730], length 75
21:40:16.012045 IP localhost.56596 > localhost.15020: Flags [.], ack 451, win 512, options [nop,nop,TS val 695122730 ecr 695122730], length 0
21:40:16.077373 IP localhost.http-alt > localhost.40176: Flags [.], ack 79, win 512, options [nop,nop,TS val 695122796 ecr 695107665], length 0
21:40:16.077381 IP localhost.40176 > localhost.http-alt: Flags [.], ack 1, win 512, options [nop,nop,TS val 695122796 ecr 695107665], length 0
21:40:18.011656 IP localhost.56516 > localhost.15020: Flags [P.], seq 729:972, ack 226, win 512, options [nop,nop,TS val 695124730 ecr 695114730], length 243
21:40:18.011794 IP localhost.15020 > localhost.56516: Flags [P.], seq 226:301, ack 972, win 1249, options [nop,nop,TS val 695124730 ecr 695124730], length 75
21:40:18.011810 IP localhost.56516 > localhost.15020: Flags [.], ack 301, win 512, options [nop,nop,TS val 6951247...
Collapse
´´´

2. Dumped goroutines
```
2020/11/09 22:35:06 === received SIGQUIT ===
*** goroutine dump...
goroutine 57 [running]:
main.main.func3()
	github.com/tektoncd/triggers/cmd/eventlistenersink/main.go:125 +0x165
created by main.main
	github.com/tektoncd/triggers/cmd/eventlistenersink/main.go:119 +0x84d

goroutine 1 [IO wait]:
internal/poll.runtime_pollWait(0x7f87e991c698, 0x72, 0x0)
	runtime/netpoll.go:220 +0x55
internal/poll.(*pollDesc).wait(0xc000028018, 0x72, 0x0, 0x0, 0x1982cef)
	internal/poll/fd_poll_runtime.go:87 +0x45
internal/poll.(*pollDesc).waitRead(...)
	internal/poll/fd_poll_runtime.go:92
internal/poll.(*FD).Accept(0xc000028000, 0x0, 0x0, 0x0, 0x0, 0x0, 0x0, 0x0)
	internal/poll/fd_unix.go:394 +0x1fc
net.(*netFD).accept(0xc000028000, 0xd08b615e802682a4, 0x0, 0x0)
	net/fd_unix.go:172 +0x45
net.(*TCPListener).accept(0xc000022560, 0x5fa9c417, 0xc000a27bc8, 0x4c9dc6)
	net/tcpsock_posix.go:139 +0x32
net.(*TCPListener).Accept(0xc000022560, 0xc000a27c18, 0x18, 0xc000000180, 0x6e2d0c)
	net/tcpsock.go:261 +0x65
net/http.(*Server).Serve(0xc00017c0e0, 0x1b9f400, 0xc000022560, 0x0, 0x0)
	net/http/server.go:2937 +0x266
net/http.(*Server).ListenAndServe(0xc00017c0e0, 0x1a2e130, 0xc0001ebe68)
	net/http/server.go:2866 +0xb7
main.main()
	github.com/tektoncd/triggers/cmd/eventlistenersink/main.go:130 +0x85b

goroutine 6 [chan receive]:
github.com/tektoncd/triggers/vendor/k8s.io/klog.(*loggingT).flushDaemon(0x28006a0)
	github.com/tektoncd/triggers/vendor/k8s.io/klog/klog.go:1010 +0x8b
created by github.com/tektoncd/triggers/vendor/k8s.io/klog.init.0
	github.com/tektoncd/triggers/vendor/k8s.io/klog/klog.go:411 +0xd8

goroutine 7 [chan receive]:
github.com/tektoncd/triggers/vendor/k8s.io/klog/v2.(*loggingT).flushDaemon(0x2800780)
	github.com/tektoncd/triggers/vendor/k8s.io/klog/v2/klog.go:1107 +0x8b
created by github.com/tektoncd/triggers/vendor/k8s.io/klog/v2.init.0
	github.com/tektoncd/triggers/vendor/k8s.io/klog/v2/klog.go:416 +0xd8

goroutine 10 [syscall]:
os/signal.signal_recv(0x1b8ea80)
	runtime/sigqueue.go:147 +0x9d
os/signal.loop()
	os/signal/signal_unix.go:23 +0x25
created by os/signal.Notify.func1.1
	os/signal/signal.go:150 +0x45

goroutine 11 [chan receive, 33 minutes]:
github.com/tektoncd/triggers/vendor/knative.dev/pkg/signals.SetupSignalHandler.func1(0xc000371380, 0xc00010a120)
	github.com/tektoncd/triggers/vendor/knative.dev/pkg/signals/signal.go:39 +0x34
created by github.com/tektoncd/triggers/vendor/knative.dev/pkg/signals.SetupSignalHandler
	github.com/tektoncd/triggers/vendor/knative.dev/pkg/signals/signal.go:38 +0xd1

goroutine 12 [sync.Cond.Wait, 33 minutes]:
runtime.goparkunlock(...)
	runtime/proc.go:312
sync.runtime_notifyListWait(0xc0005882e8, 0x1)
	runtime/sema.go:513 +0xf8
sync.(*Cond).Wait(0xc0005882d8)
	sync/cond.go:56 +0x9d
github.com/tektoncd/triggers/vendor/k8s.io/client-go/tools/cache.(*DeltaFIFO).Pop(0xc0005882c0, 0xc000515a80, 0x0, 0x0, 0x0, 0x0)
	github.com/tektoncd/triggers/vendor/k8s.io/client-go/tools/cache/delta_fifo.go:479 +0xa5
github.com/tektoncd/triggers/vendor/k8s.io/client-go/tools/cache.(*controller).processLoop(0xc0000d5680)
	github.com/tektoncd/triggers/vendor/k8s.io/client-go/tools/cache/controller.go:173 +0x42
github.com/tektoncd/triggers/vendor/k8s.io/apimachinery/pkg/util/wait.BackoffUntil.func1(0xc000114e68)
	github.com/tektoncd/triggers/vendor/k8s.io/apimachinery/pkg/util/wait/wait.go:155 +0x5f
github.com/tektoncd/triggers/vendor/k8s.io/apimachinery/pkg/util/wait.BackoffUntil(0xc000114e68, 0x1b65540, 0xc0005849f0, 0xc000505b01, 0xc00010a120)
	github.com/tektoncd/triggers/vendor/k8s.io/apimachinery/pkg/util/wait/wait.go:156 +0xad
github.com/tektoncd/triggers/vendor/k8s.io/apimachinery/pkg/util/wait.JitterUntil(0xc000114e68, 0x3b9aca00, 0x0, 0xc000148501, 0xc00010a120)
	github.com/tektoncd/triggers/vendor/k8s.io/apimachinery/pkg/util/wait/wait.go:133 +0x98
github.com/tektoncd/triggers/vendor/k8s.io/apimachinery/pkg/util/wait.Until(...)
	github.com/tektoncd/triggers/vendor/k8s.io/apimachinery/pkg/util/wait/wait.go:90
github.com/tektoncd/triggers/vendor/k8s.io/client-go/tools/cache.(*controller).Run(0xc0000d5680, 0xc00010a120)
	github.com/tektoncd/triggers/vendor/k8s.io/client-go/tools/cache/controller.go:145 +0x2ce
github.com/tektoncd/triggers/vendor/k8s.io/client-go/tools/cache.(*sharedIndexInformer).Run(0xc0004eacf0, 0xc00010a120)
	github.com/tektoncd/triggers/vendor/k8s.io/client-go/tools/cache/shared_informer.go:377 +0x41a
created by github.com/tektoncd/triggers/vendor/k8s.io/client-go/informers.(*sharedInformerFactory).Start
	github.com/tektoncd/triggers/vendor/k8s.io/client-go/informers/factory.go:135 +0x191

goroutine 18 [chan receive, 33 minutes]:
github.com/tektoncd/triggers/vendor/k8s.io/client-go/tools/cache.(*processorListener).run.func1()
	github.com/tektoncd/triggers/vendor/k8s.io/client-go/tools/cache/shared_informer.go:739 +0x5d
github.com/tektoncd/triggers/vendor/k8s.io/apimachinery/pkg/util/wait.BackoffUntil.func1(0xc0000b6760)
	github.com/tektoncd/triggers/vendor/k8s.io/apimachinery/pkg/util/wait/wait.go:155 +0x5f
github.com/tektoncd/triggers/vendor/k8s.io/apimachinery/pkg/util/wait.BackoffUntil(0xc000110f60, 0x1b65540, 0xc00010c780, 0x1731901, 0xc000540000)
	github.com/tektoncd/triggers/vendor/k8s.io/apimachinery/pkg/util/wait/wait.go:156 +0xad
github.com/tektoncd/triggers/vendor/k8s.io/apimachinery/pkg/util/wait.JitterUntil(0xc0000b6760, 0x3b9aca00, 0x0, 0x1, 0xc000540000)
	github.com/tektoncd/triggers/vendor/k8s.io/apimachinery/pkg/util/wait/wait.go:133 +0x98
github.com/tektoncd/triggers/vendor/k8s.io/apimachinery/pkg/util/wait.Until(...)
	github.com/tektoncd/triggers/vendor/k8s.io/apimachinery/pkg/util/wait/wait.go:90
github.com/tektoncd/triggers/vendor/k8s.io/client-go/tools/cache.(*processorListener).run(0xc0000d5600)
	github.com/tektoncd/triggers/vendor/k8s.io/client-go/tools/cache/shared_informer.go:738 +0x95
github.com/tektoncd/triggers/vendor/k8s.io/apimachinery/pkg/util/wait.(*Group).Start.func1(0xc00004c370, 0xc0000a46c0)
	github.com/tektoncd/triggers/vendor/k8s.io/apimachinery/pkg/util/wait/wait.go:73 +0x51
created by github.com/tektoncd/triggers/vendor/k8s.io/apimachinery/pkg/util/wait.(*Group).Start
	github.com/tektoncd/triggers/vendor/k8s.io/apimachinery/pkg/util/wait/wait.go:71 +0x65

goroutine 16 [chan receive, 33 minutes]:
github.com/tektoncd/triggers/vendor/k8s.io/client-go/tools/cache.(*sharedProcessor).run(0xc00004c310, 0xc0004fa1e0)
	github.com/tektoncd/triggers/vendor/k8s.io/client-go/tools/cache/shared_informer.go:595 +0x53
github.com/tektoncd/triggers/vendor/k8s.io/apimachinery/pkg/util/wait.(*Group).StartWithChannel.func1()
	github.com/tektoncd/triggers/vendor/k8s.io/apimachinery/pkg/util/wait/wait.go:56 +0x2e
github.com/tektoncd/triggers/vendor/k8s.io/apimachinery/pkg/util/wait.(*Group).Start.func1(0xc000505ac0, 0xc00009fa00)
	github.com/tektoncd/triggers/vendor/k8s.io/apimachinery/pkg/util/wait/wait.go:73 +0x51
created by github.com/tektoncd/triggers/vendor/k8s.io/apimachinery/pkg/util/wait.(*Group).Start
	github.com/tektoncd/triggers/vendor/k8s.io/apimachinery/pkg/util/wait/wait.go:71 +0x65

goroutine 49 [chan receive, 33 minutes]:
github.com/tektoncd/triggers/vendor/k8s.io/client-go/tools/cache.(*controller).Run.func1(0xc00010a120, 0xc0000d5680)
	github.com/tektoncd/triggers/vendor/k8s.io/client-go/tools/cache/controller.go:124 +0x34
created by github.com/tektoncd/triggers/vendor/k8s.io/client-go/tools/cache.(*controller).Run
	github.com/tektoncd/triggers/vendor/k8s.io/client-go/tools/cache/controller.go:123 +0xac

goroutine 50 [select, 7 minutes]:
github.com/tektoncd/triggers/vendor/k8s.io/client-go/tools/cache.(*Reflector).watchHandler(0xc0004f8750, 0xbfe28e7ee4515080, 0x17094d49e61, 0x28003a0, 0x1b885c0, 0xc000474bc0, 0xc000457b40, 0xc00007e600, 0xc00010a120, 0x0, ...)
	github.com/tektoncd/triggers/vendor/k8s.io/client-go/tools/cache/reflector.go:432 +0x1a5
github.com/tektoncd/triggers/vendor/k8s.io/client-go/tools/cache.(*Reflector).ListAndWatch(0xc0004f8750, 0xc00010a120, 0x0, 0x0)
	github.com/tektoncd/triggers/vendor/k8s.io/client-go/tools/cache/reflector.go:396 +0xad9
github.com/tektoncd/triggers/vendor/k8s.io/client-go/tools/cache.(*Reflector).Run.func1()
	github.com/tektoncd/triggers/vendor/k8s.io/client-go/tools/cache/reflector.go:177 +0x33
github.com/tektoncd/triggers/vendor/k8s.io/apimachinery/pkg/util/wait.BackoffUntil.func1(0xc0000b4ee0)
	github.com/tektoncd/triggers/vendor/k8s.io/apimachinery/pkg/util/wait/wait.go:155 +0x5f
github.com/tektoncd/triggers/vendor/k8s.io/apimachinery/pkg/util/wait.BackoffUntil(0xc000457ee0, 0x1b65520, 0xc0001096d0, 0xc0000b4f01, 0xc00010a120)
	github.com/tektoncd/triggers/vendor/k8s.io/apimachinery/pkg/util/wait/wait.go:156 +0xad
github.com/tektoncd/triggers/vendor/k8s.io/client-go/tools/cache.(*Reflector).Run(0xc0004f8750, 0xc00010a120)
	github.com/tektoncd/triggers/vendor/k8s.io/client-go/tools/cache/reflector.go:176 +0x186
github.com/tektoncd/triggers/vendor/k8s.io/apimachinery/pkg/util/wait.(*Group).StartWithChannel.func1()
	github.com/tektoncd/triggers/vendor/k8s.io/apimachinery/pkg/util/wait/wait.go:56 +0x2e
github.com/tektoncd/triggers/vendor/k8s.io/apimachinery/pkg/util/wait.(*Group).Start.func1(0xc000505b00, 0xc00009faa0)
	github.com/tektoncd/triggers/vendor/k8s.io/apimachinery/pkg/util/wait/wait.go:73 +0x51
created by github.com/tektoncd/triggers/vendor/k8s.io/apimachinery/pkg/util/wait.(*Group).Start
	github.com/tektoncd/triggers/vendor/k8s.io/apimachinery/pkg/util/wait/wait.go:71 +0x65

goroutine 56 [select, 33 minutes]:
github.com/tektoncd/triggers/vendor/k8s.io/client-go/tools/cache.(*Reflector).ListAndWatch.func2(0xc0004f8750, 0xc00010a120, 0xc00010a300, 0xc00007e600)
	github.com/tektoncd/triggers/vendor/k8s.io/client-go/tools/cache/reflector.go:329 +0x14a
created by github.com/tektoncd/triggers/vendor/k8s.io/client-go/tools/cache.(*Reflector).ListAndWatch
	github.com/tektoncd/triggers/vendor/k8s.io/client-go/tools/cache/reflector.go:323 +0x285

goroutine 19 [select, 33 minutes]:
github.com/tektoncd/triggers/vendor/k8s.io/client-go/tools/cache.(*processorListener).pop(0xc0000d5600)
	github.com/tektoncd/triggers/vendor/k8s.io/client-go/tools/cache/shared_informer.go:709 +0x157
github.com/tektoncd/triggers/vendor/k8s.io/apimachinery/pkg/util/wait.(*Group).Start.func1(0xc00004c370, 0xc0000a46d0)
	github.com/tektoncd/triggers/vendor/k8s.io/apimachinery/pkg/util/wait/wait.go:73 +0x51
created by github.com/tektoncd/triggers/vendor/k8s.io/apimachinery/pkg/util/wait.(*Group).Start
	github.com/tektoncd/triggers/vendor/k8s.io/apimachinery/pkg/util/wait/wait.go:71 +0x65

goroutine 55 [IO wait, 7 minutes]:
internal/poll.runtime_pollWait(0x7f87e991c778, 0x72, 0x1b67880)
	runtime/netpoll.go:220 +0x55
internal/poll.(*pollDesc).wait(0xc0000d5998, 0x72, 0x1b67800, 0x276b638, 0x0)
	internal/poll/fd_poll_runtime.go:87 +0x45
internal/poll.(*pollDesc).waitRead(...)
	internal/poll/fd_poll_runtime.go:92
internal/poll.(*FD).Read(0xc0000d5980, 0xc0003f8000, 0x193f, 0x193f, 0x0, 0x0, 0x0)
	internal/poll/fd_unix.go:159 +0x1a5
net.(*netFD).Read(0xc0000d5980, 0xc0003f8000, 0x193f, 0x193f, 0x203000, 0x61d3db, 0xc0005a8160)
	net/fd_posix.go:55 +0x4f
net.(*conn).Read(0xc0000a2000, 0xc0003f8000, 0x193f, 0x193f, 0x0, 0x0, 0x0)
	net/net.go:182 +0x8e
crypto/tls.(*atLeastReader).Read(0xc0008c2280, 0xc0003f8000, 0x193f, 0x193f, 0x35, 0x193a, 0xc000163710)
	crypto/tls/conn.go:779 +0x62
bytes.(*Buffer).ReadFrom(0xc0005a8280, 0x1b62ca0, 0xc0008c2280, 0x40b3a5, 0x1787380, 0x19077a0)
	bytes/buffer.go:204 +0xb1
crypto/tls.(*Conn).readFromUntil(0xc0005a8000, 0x1b65de0, 0xc0000a2000, 0x5, 0xc0000a2000, 0x7f87e98b62d8)
	crypto/tls/conn.go:801 +0xf3
crypto/tls.(*Conn).readRecordOrCCS(0xc0005a8000, 0x0, 0x0, 0xc0008d2ae0)
	crypto/tls/conn.go:608 +0x115
crypto/tls.(*Conn).readRecord(...)
	crypto/tls/conn.go:576
crypto/tls.(*Conn).Read(0xc0005a8000, 0xc000174000, 0x1000, 0x1000, 0x0, 0x0, 0x0)
	crypto/tls/conn.go:1252 +0x15f
bufio.(*Reader).Read(0xc0001f8900, 0xc000512498, 0x9, 0x9, 0xc000581500, 0xc000163d28, 0x405ce9)
	bufio/bufio.go:227 +0x222
io.ReadAtLeast(0x1b62b40, 0xc0001f8900, 0xc000512498, 0x9, 0x9, 0x9, 0x197fd03, 0x460380, 0xc000afa120)
	io/io.go:314 +0x87
io.ReadFull(...)
	io/io.go:333
github.com/tektoncd/triggers/vendor/golang.org/x/net/http2.readFrameHeader(0xc000512498, 0x9, 0x9, 0x1b62b40, 0xc0001f8900, 0x0, 0xc000000000, 0xc0008d2a20, 0xc0005d27e0)
	github.com/tektoncd/triggers/vendor/golang.org/x/net/http2/frame.go:237 +0x89
github.com/tektoncd/triggers/vendor/golang.org/x/net/http2.(*Framer).ReadFrame(0xc000512460, 0xc0008d2a20, 0x0, 0x0, 0x0)
	github.com/tektoncd/triggers/vendor/golang.org/x/net/http2/frame.go:492 +0xa5
github.com/tektoncd/triggers/vendor/golang.org/x/net/http2.(*clientConnReadLoop).run(0xc000163fa8, 0x0, 0x0)
	github.com/tektoncd/triggers/vendor/golang.org/x/net/http2/transport.go:1794 +0xd8
github.com/tektoncd/triggers/vendor/golang.org/x/net/http2.(*ClientConn).readLoop(0xc000581b00)
	github.com/tektoncd/triggers/vendor/golang.org/x/net/http2/transport.go:1716 +0x6f
created by github.com/tektoncd/triggers/vendor/golang.org/x/net/http2.(*Transport).newClientConn
	github.com/tektoncd/triggers/vendor/golang.org/x/net/http2/transport.go:695 +0x66e

goroutine 886 [sync.Cond.Wait, 7 minutes]:
runtime.goparkunlock(...)
	runtime/proc.go:312
sync.runtime_notifyListWait(0xc0004e1380, 0x0)
	runtime/sema.go:513 +0xf8
sync.(*Cond).Wait(0xc0004e1370)
	sync/cond.go:56 +0x9d
github.com/tektoncd/triggers/vendor/golang.org/x/net/http2.(*pipe).Read(0xc0004e1368, 0xc0002f8400, 0x200, 0x200, 0x0, 0x0, 0x0)
	github.com/tektoncd/triggers/vendor/golang.org/x/net/http2/pipe.go:65 +0x97
github.com/tektoncd/triggers/vendor/golang.org/x/net/http2.transportResponseBody.Read(0xc0004e1340, 0xc0002f8400, 0x200, 0x200, 0x0, 0x0, 0x0)
	github.com/tektoncd/triggers/vendor/golang.org/x/net/http2/transport.go:2083 +0xaf
encoding/json.(*Decoder).refill(0xc0004e1600, 0x18, 0x7f88105e8560)
	encoding/json/stream.go:165 +0xeb
encoding/json.(*Decoder).readValue(0xc0004e1600, 0x0, 0x0, 0x17479c0)
	encoding/json/stream.go:140 +0x1ff
encoding/json.(*Decoder).Decode(0xc0004e1600, 0x176f3e0, 0xc0008c22c0, 0x0, 0x0)
	encoding/json/stream.go:63 +0x79
github.com/tektoncd/triggers/vendor/k8s.io/apimachinery/pkg/util/framer.(*jsonFrameReader).Read(0xc0008d2b40, 0xc000142400, 0x400, 0x400, 0x0, 0x7f87e9897988, 0x38)
	github.com/tektoncd/triggers/vendor/k8s.io/apimachinery/pkg/util/framer/framer.go:150 +0x1a8
github.com/tektoncd/triggers/vendor/k8s.io/apimachinery/pkg/runtime/serializer/streaming.(*decoder).Decode(0xc000a2c2d0, 0x0, 0x1b88240, 0xc000474c00, 0x0, 0x0, 0x0, 0x0, 0x0)
	github.com/tektoncd/triggers/vendor/k8s.io/apimachinery/pkg/runtime/serializer/streaming/streaming.go:77 +0x89
github.com/tektoncd/triggers/vendor/k8s.io/client-go/rest/watch.(*Decoder).Decode(0xc0008c22a0, 0x0, 0x0, 0x0, 0x0, 0x0, 0x0)
	github.com/tektoncd/triggers/vendor/k8s.io/client-go/rest/watch/decoder.go:49 +0x6e
github.com/tektoncd/triggers/vendor/k8s.io/apimachinery/pkg/watch.(*StreamWatcher).receive(0xc000474bc0)
	github.com/tektoncd/triggers/vendor/k8s.io/apimachinery/pkg/watch/streamwatcher.go:104 +0x147
created by github.com/tektoncd/triggers/vendor/k8s.io/apimachinery/pkg/watch.NewStreamWatcher
	github.com/tektoncd/triggers/vendor/k8s.io/apimachinery/pkg/watch/streamwatcher.go:71 +0xbe

goroutine 992 [select]:
github.com/tektoncd/triggers/vendor/golang.org/x/net/http2.(*ClientConn).roundTrip(0xc000581b00, 0xc0002c1c00, 0x0, 0x0, 0x0, 0x0)
	github.com/tektoncd/triggers/vendor/golang.org/x/net/http2/transport.go:1143 +0x9aa
github.com/tektoncd/triggers/vendor/golang.org/x/net/http2.(*Transport).RoundTripOpt(0xc00004c2a0, 0xc0002c1c00, 0x1755f00, 0xc0000c2960, 0xc00021e100, 0x5)
	github.com/tektoncd/triggers/vendor/golang.org/x/net/http2/transport.go:469 +0x170
github.com/tektoncd/triggers/vendor/golang.org/x/net/http2.(*Transport).RoundTrip(...)
	github.com/tektoncd/triggers/vendor/golang.org/x/net/http2/transport.go:430
github.com/tektoncd/triggers/vendor/golang.org/x/net/http2.noDialH2RoundTripper.RoundTrip(0xc00004c2a0, 0xc0002c1c00, 0x1b66d00, 0xc00004c2a0, 0x0)
	github.com/tektoncd/triggers/vendor/golang.org/x/net/http2/transport.go:2666 +0x3e
net/http.(*Transport).roundTrip(0xc000148000, 0xc0002c1c00, 0x16f6f40, 0xc000776a01, 0xc0004e09a0)
	net/http/transport.go:527 +0xd8c
net/http.(*Transport).RoundTrip(0xc000148000, 0xc0002c1c00, 0x1989bf1, 0xd, 0xc0004e0a58)
	net/http/roundtrip.go:17 +0x35
github.com/tektoncd/triggers/vendor/k8s.io/client-go/transport.(*bearerAuthRoundTripper).RoundTrip(0xc00023d6b0, 0xc0002c1b00, 0x1986b65, 0xa, 0xc0004e08e0)
	github.com/tektoncd/triggers/vendor/k8s.io/client-go/transport/round_trippers.go:297 +0x271
github.com/tektoncd/triggers/vendor/k8s.io/client-go/transport.(*userAgentRoundTripper).RoundTrip(0xc000022420, 0xc0002c1a00, 0xc000022420, 0x0, 0x0)
	github.com/tektoncd/triggers/vendor/k8s.io/client-go/transport/round_trippers.go:159 +0x1d6
net/http.send(0xc0002c1a00, 0x1b65b80, 0xc000022420, 0x0, 0x0, 0x0, 0xc000898020, 0x1987051, 0x1, 0x0)
	net/http/client.go:252 +0x453
net/http.(*Client).send(0xc00023d6e0, 0xc0002c1a00, 0x0, 0x0, 0x0, 0xc000898020, 0x0, 0x1, 0x0)
	net/http/client.go:176 +0xff
net/http.(*Client).do(0xc00023d6e0, 0xc0002c1a00, 0x0, 0x0, 0x0)
	net/http/client.go:718 +0x45f
net/http.(*Client).Do(...)
	net/http/client.go:586
github.com/tektoncd/triggers/vendor/k8s.io/client-go/rest.(*Request).request(0xc0000c09a0, 0x1ba7640, 0xc000056028, 0xc0003f7438, 0x0, 0x0)
	github.com/tektoncd/triggers/vendor/k8s.io/client-go/rest/request.go:855 +0x44d
github.com/tektoncd/triggers/vendor/k8s.io/client-go/rest.(*Request).Do(0xc0000c09a0, 0x1ba7640, 0xc000056028, 0x0, 0x0, 0x0, 0x0, 0x0, 0x0, 0x0, ...)
	github.com/tektoncd/triggers/vendor/k8s.io/client-go/rest/request.go:928 +0xd1
github.com/tektoncd/triggers/pkg/client/clientset/versioned/typed/triggers/v1alpha1.(*eventListeners).Get(0xc0008c2000, 0x1ba7640, 0xc000056028, 0x7ffe61b63a90, 0x14, 0x0, 0x0, 0x0, 0x0, 0x0, ...)
	github.com/tektoncd/triggers/pkg/client/clientset/versioned/typed/triggers/v1alpha1/eventlistener.go:75 +0x1ad
github.com/tektoncd/triggers/pkg/sink.Sink.HandleEvent(0x1bce020, 0xc0001bc420, 0x1b81e40, 0xc00056ea20, 0x7f87e9784d18, 0xc0000223a0, 0x1b62e20, 0xc0005101c8, 0x27ffb60, 0x7ffe61b63a90, ...)
	github.com/tektoncd/triggers/pkg/sink/sink.go:72 +0xd2
net/http.HandlerFunc.ServeHTTP(0xc000279170, 0x1b9f6c0, 0xc0000c08c0, 0xc0002c1800)
	net/http/server.go:2042 +0x44
net/http.(*ServeMux).ServeHTTP(0xc0000c64c0, 0x1b9f6c0, 0xc0000c08c0, 0xc0002c1800)
	net/http/server.go:2417 +0x1ad
net/http.serverHandler.ServeHTTP(0xc00017c0e0, 0x1b9f6c0, 0xc0000c08c0, 0xc0002c1800)
	net/http/server.go:2843 +0xa3
net/http.(*conn).serve(0xc000186b40, 0x1ba7600, 0xc0007f4280)
	net/http/server.go:1925 +0x8ad
created by net/http.(*Server).Serve
	net/http/server.go:2969 +0x36c

*** end

```

3. No pattern and restarting helps but just a little while before it hangs

4. for a little while

**Comment by dibyom** [comment]
Two potentially interesting things:

1. goroutine 55 [IO wait, 7 minutes]:
7 mins waiting to readHeaders -> maybe the read/write timeouts from https://github.com/tektoncd/triggers/pull/747 will help here?


2.

> github.com/tektoncd/triggers/vendor/golang.org/x/net/http2.readFrameHeader(0xc000512498, 0x9, 0x9, 0x1b62b40, 0xc0001f8900, 0x0, 0xc000000000, 0xc0008d2a20, 0xc0005d27e0)
	github.com/tektoncd/triggers/vendor/golang.org/x/net/http2/frame.go:237 +0x89
github.com/tektoncd/triggers/vendor/golang.org/x/net/http2.(*Framer).ReadFrame(0xc000512460, 0xc0008d2a20, 0x0, 0x0, 0x0)
	github.com/tektoncd/triggers/vendor/golang.org/x/net/http2/frame.go:492 +0xa5


Looks like we are trying to read a http2 frame...idk much about http2, maybe istio is configured to use http2 and perhaps using http1 would fix this? (Also, I'm not sure if someone has tried http2 with Triggers and has confirmed it working).


3. 

> crypto/tls.(*Conn).readFromUntil(0xc0005a8000, 0x1b65de0, 0xc0000a2000, 0x5, 0xc0000a2000, 0x7f87e98b62d8)
	crypto/tls/conn.go:801 +0xf3
crypto/tls.(*Conn).readRecordOrCCS(0xc0005a8000, 0x0, 0x0, 0xc0008d2ae0)
	crypto/tls/conn.go:608 +0x115
crypto/tls.(*Conn).readRecord(...)
	crypto/tls/conn.go:576
crypto/tls.(*Conn).Read(0xc0005a8000, 0xc000174000, 0x1000, 0x1000, 0x0, 0x0, 0x0)
	crypto/tls/conn.go:1252 +0x15f


Also interesting  the trace contains `crypto/tls`.  I don't think we support TLS out of the box yet (@savitaashture is adding support in  https://github.com/tektoncd/triggers/pull/819)

**Comment by ekarlso** [comment]
@dibyom yes it seems that the PR you linked in fixed the issue here
